{
  "schema_version": "frankenjax.e2e-forensic-log.v1",
  "bead_id": "frankenjax-cstq.12",
  "scenario_id": "e2e_architecture_boundary_gate",
  "test_id": "fj_architecture_boundary_gate",
  "packet_id": null,
  "command": [
    "/dev/shm/cargo-target-frankenjax/debug/fj_architecture_boundary_gate",
    "--enforce"
  ],
  "working_dir": "/data/projects/frankenjax",
  "environment": {
    "os": "linux",
    "arch": "x86_64",
    "rust_version": "rustc 1.100.0-nightly (908501772 2026-08-30)",
    "cargo_version": "cargo 1.100.0-nightly (e8cb624d5 2026-08-22)",
    "cargo_target_dir": "/dev/shm/cargo-target-frankenjax",
    "env_vars": {
      "CARGO_TARGET_DIR": "/dev/shm/cargo-target-frankenjax"
    },
    "timestamp_unix_ms": 1792389770203
  },
  "feature_flags": [],
  "fixture_ids": [
    "user_api_facade",
    "transform_stack",
    "lowering_execution",
    "cpu_backend",
    "ffi_boundary",
    "conformance_harness"
  ],
  "oracle_ids": [
    "docs/planning/EXISTING_JAX_STRUCTURE.md",
    "docs/planning/PROPOSED_ARCHITECTURE.md",
    "cargo metadata --no-deps"
  ],
  "transform_stack": [
    "architecture",
    "facade",
    "lowering",
    "runtime_backend"
  ],
  "mode": "strict",
  "inputs": {
    "crate_count": 17,
    "decision_ids": [
      "user_api_facade",
      "transform_stack",
      "lowering_execution",
      "cpu_backend",
      "ffi_boundary",
      "conformance_harness"
    ],
    "normal_edge_count": 55,
    "workspace_root": "/data/projects/frankenjax"
  },
  "expected": {
    "dependency_cycles": 0,
    "gate_status": "pass",
    "layer_violations": 0,
    "missing_decision_fields": 0
  },
  "actual": {
    "crate_count": 17,
    "decision_count": 6,
    "decisions": [
      {
        "boundary_id": "user_api_facade",
        "decision": "keep_current_boundary",
        "owners": [
          "fj-api",
          "fj-trace",
          "fj-py"
        ],
        "status": "accepted"
      },
      {
        "boundary_id": "transform_stack",
        "decision": "defer_extraction",
        "owners": [
          "fj-core",
          "fj-dispatch",
          "fj-ad",
          "fj-trace",
          "fj-api"
        ],
        "status": "accepted"
      },
      {
        "boundary_id": "lowering_execution",
        "decision": "defer_extraction",
        "owners": [
          "fj-interpreters",
          "fj-dispatch",
          "fj-backend-cpu",
          "fj-backend-gpu",
          "fj-runtime"
        ],
        "status": "accepted"
      },
      {
        "boundary_id": "cpu_backend",
        "decision": "keep_current_boundary",
        "owners": [
          "fj-backend-cpu",
          "fj-runtime"
        ],
        "status": "accepted"
      },
      {
        "boundary_id": "ffi_boundary",
        "decision": "keep_current_boundary",
        "owners": [
          "fj-ffi"
        ],
        "status": "accepted"
      },
      {
        "boundary_id": "conformance_harness",
        "decision": "keep_current_boundary",
        "owners": [
          "fj-conformance"
        ],
        "status": "accepted"
      }
    ],
    "issue_count": 0,
    "normal_edge_count": 55,
    "status": "pass"
  },
  "tolerance": {
    "policy_id": "exact_architecture_boundary_gate",
    "atol": null,
    "rtol": null,
    "ulp": null,
    "notes": "workspace graph, boundary owners, rejected alternatives, and guardrails are exact"
  },
  "error": {
    "expected": null,
    "actual": null,
    "taxonomy_class": "none"
  },
  "timings": {
    "setup_ms": 0,
    "trace_ms": 0,
    "dispatch_ms": 0,
    "eval_ms": 0,
    "verify_ms": 0,
    "total_ms": 0
  },
  "allocations": {
    "allocation_count": null,
    "allocated_bytes": null,
    "peak_rss_bytes": null,
    "measurement_backend": "not_measured"
  },
  "artifacts": [
    {
      "kind": "architecture_boundary_report",
      "path": "artifacts/conformance/architecture_boundary_decision.v1.json",
      "sha256": "3698257f59bda92323ad450b325b08369a75e794416316cc4d474caa48e90101",
      "required": true
    },
    {
      "kind": "architecture_boundary_markdown",
      "path": "artifacts/conformance/architecture_boundary_decision.v1.md",
      "sha256": "c4fd47dd5c033515c2ae2c34340ae24e5024c90b4a54b796b20fbccf7f225817",
      "required": true
    }
  ],
  "replay_command": "./scripts/run_architecture_boundary_gate.sh --enforce",
  "status": "pass",
  "failure_summary": null,
  "redactions": [],
  "metadata": {
    "bead": {
      "id": "frankenjax-cstq.12",
      "title": "Decide transform/lowering/API facade crate boundary extraction"
    }
  }
}
